{
  "for_round": 4,
  "base_version": 3,
  "issues": [
    {
      "source": "R06",
      "section": "S09",
      "points_at_stake": 11.25,
      "text": "R06 قیمت و شرایط تجاری: نمره ۱ از ۴. یک بازه‌ی برآوردی یا مبنای محاسبه (قیمت ثابت یا زمان با سقف) و نقاط پرداخت وصل‌شده به D-01 تا D-03 تعیین و مالک تأیید کند.؛ علت سقف: CHK-PAY-PERCENT ≤ ۱ (جمع درصد پرداخت‌ها ۰ است، نه ۱۰۰) (محدود به ورودی: بدون اطلاعات تازه بهتر نمی‌شود)",
      "severity": "critical",
      "id": "I-01"
    },
    {
      "source": "CHK-PAY-PERCENT",
      "severity": "critical",
      "section": "S09",
      "text": "CHK-PAY-PERCENT: جمع درصد پرداخت‌ها ۰ است، نه ۱۰۰",
      "points_at_stake": null,
      "id": "I-02"
    },
    {
      "source": "R08",
      "section": "S14",
      "points_at_stake": 3.75,
      "text": "R08 proof و صداقت ادعا: نمره ۱ از ۴. خروجی آزمون داخلی روی داده‌ی ساختگی را ضمیمه کنید یا نمونه‌ای با مجوز انتشار بیاورید.؛ علت سقف: judge-claims ≤ ۱ (۱ ادعای unsupported: «در پایلوت فقط نمونه‌ی ناشناس‌شده‌ی درخواست‌های قیمت استفاده ») (محدود به ورودی: بدون اطلاعات تازه بهتر نمی‌شود)",
      "severity": "below_min",
      "id": "I-03"
    },
    {
      "source": "R05",
      "section": "S07",
      "points_at_stake": 5.0,
      "text": "R05 فرایند، زمان و نقش‌ها: نمره ۲ از ۴. ظرفیت ساعتی بازبین و مسئول داده را تعیین کنید و مدت هر مرحله را برآورد کنید. (محدود به ورودی: بدون اطلاعات تازه بهتر نمی‌شود)",
      "severity": "below_target",
      "id": "I-04"
    },
    {
      "source": "R07",
      "section": "S10",
      "points_at_stake": 5.0,
      "text": "R07 امنیت، فرض‌ها و ریسک: نمره ۲ از ۴. مسئول داده‌ی مشتری را تعیین کنید تا محل پردازش، نگهداری، حذف و مسیر رخداد پیش از شروع پاسخ داده شود. (محدود به ورودی: بدون اطلاعات تازه بهتر نمی‌شود)",
      "severity": "below_target",
      "id": "I-05"
    },
    {
      "source": "R01",
      "section": "S02",
      "points_at_stake": 3.75,
      "text": "R01 شناخت و شخصی‌سازی مشتری: نمره ۳ از ۴. حجم درخواست‌ها و نرخ اصلاح فعلی را از مدیر فروش بگیرید و در بخش تشخیص بنویسید.",
      "severity": "below_target",
      "id": "I-06"
    },
    {
      "source": "R03",
      "section": "S05",
      "points_at_stake": 3.75,
      "text": "R03 دامنه و تحویل‌دادنی: نمره ۳ از ۴. دسته‌ی محصول را انتخاب و قالب و موعد D-01 تا D-03 را در سند قیمت و برنامه ثابت کنید. (محدود به ورودی: بدون اطلاعات تازه بهتر نمی‌شود)",
      "severity": "below_target",
      "id": "I-07"
    },
    {
      "source": "R02",
      "section": "S04",
      "points_at_stake": 2.5,
      "text": "R02 نتیجه و معیار سنجش: نمره ۳ از ۴. مالک و ابزار ثبت را در جلسه‌ی تأیید دامنه (U-07) از مدیر فروش تأیید بگیرید. (محدود به ورودی: بدون اطلاعات تازه بهتر نمی‌شود)",
      "severity": "below_target",
      "id": "I-08"
    },
    {
      "source": "R04",
      "section": "S10",
      "points_at_stake": 2.5,
      "text": "R04 پذیرش و مدیریت تغییر: نمره ۳ از ۴. تعریف بازنگری و تعداد آن (U-17) و بازه‌ی اصلاح ایراد (U-21) را با مدیر فروش نهایی کنید. (محدود به ورودی: بدون اطلاعات تازه بهتر نمی‌شود)",
      "severity": "below_target",
      "id": "I-09"
    },
    {
      "source": "R09",
      "section": null,
      "points_at_stake": 1.25,
      "text": "R09 نگارش و طراحی و دسترس‌پذیری: نمره ۳ از ۴. در متن اصلی ارجاع‌های U و C را کم کنید و نامعلوم‌های تکراری را به جدول U-ها بسپارید.",
      "severity": "below_target",
      "id": "I-10"
    },
    {
      "source": "R10",
      "section": "S01",
      "points_at_stake": 1.25,
      "text": "R10 گام بعد و انطباق با دستور مشتری: نمره ۳ از ۴. تاریخ دقیق «پایان ماه» را (U-24) بنویسید.",
      "severity": "below_target",
      "id": "I-11"
    },
    {
      "source": "CHK-LENGTH",
      "severity": "warn",
      "section": null,
      "text": "CHK-LENGTH: ۴۷۹۷ کلمه؛ بودجه ۱۰۰۰ تا ۳۲۰۰",
      "points_at_stake": null,
      "id": "I-12"
    }
  ],
  "regressions": []
}
